{"canonical_input":"1","decimal_places":6,"exact_result_denominator":"15625","exact_result_numerator":"25146","factor_denominator":"15625","factor_numerator":"25146","original_input":"1","receipt_schema":"measuretrace.conversion-receipt.v1","receipt_sha256":"ea0d204079c86b24bce4213d3365afe06d185811918cd45dded3cef7414adca9","registry_id":"nist-bipm-length-v1","registry_sha256":"c139e57cc638b889c67ceebbe39a7a618fbe2bde5416626c9a9db9734f625c62","rounded_result":"1.609344","rounding_mode":"ROUND_HALF_EVEN","source_unit":"mi","target_unit":"km"}
